Libellé;Prix;Description
Chargeurs de téléphones Portables;22.98;"Samsung EP-P1100. Type de chargeur: Intérieur;
Type de source d'alimentation: Secteur;
Compatibilité de chargeur: Smartphone;
Charge rapide. Couleur du produit: Noir"
Playmobil Hydravion de Police;14.39;L'intérieur de l'avion peut contenir deux personnages et une valise.
Distributeur de croquettes pour chien;12.99;Distributeur de nourriture croquettes, biscuits ou snacks pour chats et chiens Plastique robuste avec couvercle amovible
